{
  "schema": "qed-glossary-public-object-v1",
  "object_id": "glossary.monitoring.systematic-status-checking",
  "revision_id": "revision.glossary.6b8b88410ab5e075bfe518d3",
  "headword": "Monitoring",
  "scope_label": "systematic checking of a process or condition over time in quality management",
  "definition": "Monitoring is systematic checking of a process or condition over time to learn its status or detect change.",
  "explanation": [
    "The subject and checking schedule should be clear enough to interpret what is observed.",
    "Monitoring supplies observations; changing the process in response is a separate action."
  ],
  "content_license": "CC0-1.0",
  "review": {
    "owner_editorial": true,
    "owner_source_attestation": true,
    "internal_validation": true,
    "owner_release_authorization": true,
    "independent_external_review": false
  }
}
