{
  "schema": "qed-glossary-public-object-v1",
  "object_id": "glossary.quality-culture.shared-practice",
  "revision_id": "revision.glossary.a3538d3ad1ad500d62a8157d",
  "headword": "Quality culture",
  "scope_label": "shared organizational expectations and practice",
  "definition": "Quality culture is the shared expectations and everyday practices through which an organization pursues, examines, and improves quality.",
  "explanation": [
    "It becomes visible in what leaders and staff do: how concerns are communicated, how performance is examined, and whether learning changes routine work.",
    "A stated value or a formal quality procedure is not sufficient evidence of such a culture on its own. Look for consistent behavior across roles and over time."
  ],
  "content_license": "CC0-1.0",
  "review": {
    "owner_editorial": true,
    "owner_source_attestation": true,
    "internal_validation": true,
    "owner_release_authorization": true,
    "independent_external_review": false
  }
}
