{
  "schema": "qed-glossary-public-object-v1",
  "object_id": "glossary.sensitivity.diagnostic-test",
  "revision_id": "revision.glossary.052a88b660590b7a21820537",
  "headword": "Sensitivity",
  "scope_label": "sensitivity of a diagnostic test for a target condition",
  "definition": "For a diagnostic test, sensitivity is the proportion of people with the target condition who receive a positive result under a stated test rule.",
  "explanation": [
    "It is the probability of a positive result given that the condition is present.",
    "It is not the probability that someone with a positive result has the condition; that also depends on other factors, including how common the condition is in the tested population."
  ],
  "content_license": "CC0-1.0",
  "review": {
    "owner_editorial": true,
    "owner_source_attestation": true,
    "internal_validation": true,
    "owner_release_authorization": true,
    "independent_external_review": false
  }
}
