{
  "schema": "qed-glossary-public-object-v1",
  "object_id": "glossary.authority.project-governance-decision",
  "revision_id": "revision.glossary.11a240bce8354e5b35ec99f8",
  "headword": "Authority",
  "scope_label": "delegated decision and resource power in project governance",
  "definition": "In project governance, authority is an assigned power to make decisions or commit resources within a defined remit.",
  "explanation": [
    "A clear assignment identifies who holds that power, which decisions it covers, and its limits.",
    "Expertise or a stake in the decision does not, by itself, confer authority to make it."
  ],
  "content_license": "CC0-1.0",
  "review": {
    "owner_editorial": true,
    "owner_source_attestation": true,
    "internal_validation": true,
    "owner_release_authorization": true,
    "independent_external_review": false
  }
}
