{
  "schema": "qed-glossary-public-object-v1",
  "object_id": "glossary.credibility.argument-evidence-believability",
  "revision_id": "revision.glossary.eb17acbc4bff64b9743b4459",
  "headword": "Credibility",
  "scope_label": "believability of a claim or source in argument evaluation",
  "definition": "In evaluating an argument, credibility is the degree to which a claim or supporting source is believable on relevant grounds.",
  "explanation": [
    "Those grounds may include the reliability of the data or the relevant expertise behind a claim.",
    "Credible support still has to be relevant and sufficient for the conclusion; credibility alone does not settle the argument."
  ],
  "content_license": "CC0-1.0",
  "review": {
    "owner_editorial": true,
    "owner_source_attestation": true,
    "internal_validation": true,
    "owner_release_authorization": true,
    "independent_external_review": false
  }
}
