{
  "schema": "qed-glossary-public-object-v1",
  "object_id": "glossary.objective-evidence.checkable-claim-support",
  "revision_id": "revision.glossary.e2cbf0433fa39883b28d2645",
  "headword": "Objective evidence",
  "scope_label": "checkable data bearing on existence or truth in quality management",
  "definition": "In quality management, objective evidence is checkable information that supports whether a specified condition exists or a claim is true.",
  "explanation": [
    "It may come from observations, measurements, tests, or records, provided they bear on the matter being checked.",
    "Calling evidence objective does not make its interpretation automatic; the claim and the way the information was obtained still matter."
  ],
  "content_license": "CC0-1.0",
  "review": {
    "owner_editorial": true,
    "owner_source_attestation": true,
    "internal_validation": true,
    "owner_release_authorization": true,
    "independent_external_review": false
  }
}
