{
  "schema": "qed-glossary-public-object-v1",
  "object_id": "glossary.voice-of-the-customer.qfd-input",
  "revision_id": "revision.glossary.ebcf6c087b27aa2847576356",
  "headword": "Voice of the customer",
  "scope_label": "customer evidence used in QFD inquiry",
  "definition": "In QFD, voice of the customer is information gathered about identified customers’ needs, expectations, and use of a product or service.",
  "explanation": [
    "It may include what customers say directly and what investigation reveals about needs they have not stated. Who was heard, in what setting, and through which method affects what the information can support.",
    "A customer statement is evidence to interpret, not automatically a well-specified requirement. A team should test its translation of that information before using it to direct a design."
  ],
  "content_license": "CC0-1.0",
  "review": {
    "owner_editorial": true,
    "owner_source_attestation": true,
    "internal_validation": true,
    "owner_release_authorization": true,
    "independent_external_review": false
  }
}
