{
  "schema": "qed-glossary-public-object-v1",
  "object_id": "glossary.measurement-system.metrology",
  "revision_id": "revision.glossary.0017219b1bffffd1a34dc329",
  "headword": "Measurement system",
  "scope_label": "arrangement used to obtain values in metrology",
  "definition": "In metrology, a measurement system is the instruments, procedures, people, and operating conditions used together to obtain values for a specified quantity.",
  "explanation": [
    "Its configuration includes the reference, test item, method, and environment where these affect the result.",
    "Variation from the measuring arrangement can be mistaken for variation in the subject being measured."
  ],
  "content_license": "CC0-1.0",
  "review": {
    "owner_editorial": true,
    "owner_source_attestation": true,
    "internal_validation": true,
    "owner_release_authorization": true,
    "independent_external_review": false
  }
}
