{
  "schema": "qed-glossary-public-object-v1",
  "object_id": "glossary.audit-criteria.management-system-reference",
  "revision_id": "revision.glossary.7bda70205361a766d7255fb5",
  "headword": "Audit criteria",
  "scope_label": "requirements used as a comparison basis in management-system auditing",
  "definition": "In a management-system audit, audit criteria are the requirements used as the reference for judging audit evidence.",
  "explanation": [
    "They may come from policies, procedures, contracts, or applicable legal requirements.",
    "The criteria state the basis for comparison; findings result from comparing relevant evidence with that basis."
  ],
  "content_license": "CC0-1.0",
  "review": {
    "owner_editorial": true,
    "owner_source_attestation": true,
    "internal_validation": true,
    "owner_release_authorization": true,
    "independent_external_review": false
  }
}
