{
  "schema": "qed-glossary-public-object-v1",
  "object_id": "glossary.cost-of-poor-quality.failure-costs",
  "revision_id": "revision.glossary.ff617e91a07ae021810a11ea",
  "headword": "Cost of poor quality (COPQ)",
  "scope_label": "costs attributable to defects and other quality failures",
  "definition": "Cost of poor quality (COPQ) is the estimated cost attributable to failures to meet relevant quality requirements.",
  "explanation": [
    "It can include scrap and rework found before delivery, and returns, warranty work, complaints, or other consequences found afterward. Some costs are difficult to observe or assign.",
    "An estimate needs a stated accounting boundary, time period, and basis for attributing costs. Prevention and appraisal costs are often reported separately as costs of achieving quality; naming the convention avoids misleading comparisons."
  ],
  "content_license": "CC0-1.0",
  "review": {
    "owner_editorial": true,
    "owner_source_attestation": true,
    "internal_validation": true,
    "owner_release_authorization": true,
    "independent_external_review": false
  }
}
